天宝伏妖录动漫已经更新了，请播放13集	Video-Play
今天上午6点我要去遛狗，帮我设置一下吧。	Alarm-Update
播放电影，张子枫主演的唐山大地震	FilmTele-Play
把之前收藏的3月6日更新的奇葩说放了	Video-Play
给我听林忆莲的《爱上一个不回家的人》	Music-Play
英文演奏的萨克斯有没有推荐的	Music-Play
冷冻室温度有点高，帮我降3度行吧	HomeAppliance-Control
能帮我找到陈赫参加爱情公寓三发布会的视频吗	Video-Play
7月23号是农历几月几日	Calendar-Query
我想播放林启得的大田俊生仔	Music-Play
查询未来一周兰州天气状况	Weather-Query
明天晚上10点的闹钟定好	Alarm-Update
播放赵雷的民谣南方姑娘。	Music-Play
我得听点儿励志歌儿，播放怒放的生命	Music-Play
给我定一个4月1日8点的闹铃	Alarm-Update
帮我让洗衣机进入脱水模式吧	HomeAppliance-Control
找几个孙燕姿的演唱会视频来看	Video-Play
立即查查看上海到深圳的G2321次列车还有没有甲等座	Travel-Query
北京今天空气质量好吗	Weather-Query
可以帮我把扫地机器人关掉吗	HomeAppliance-Control
我估计一会儿就要开始播放FM106.1的中国之声了	Radio-Listen
沈文裕的钢琴曲可以播放不	Music-Play
明天是星期几	Calendar-Query
你能播放玄幻类型的电视剧香蜜吗	FilmTele-Play
播放一个大岳丸CG视频	Video-Play
帮我播放一下李季主持的电台节目音乐high一点	Radio-Listen
你能给我播放一个欢快的韩语歌吗	Music-Play
是否可以给我调到王晓主持的咨询热线	Radio-Listen
明天空气怎么样污染大不大	Weather-Query
帮我查查建军节是农历9月初1吗	Calendar-Query
2019年出的电影流浪地球播放一下呢	FilmTele-Play
动作电影就看美国的碟中谍咯	FilmTele-Play
你能给我收听一下音乐类的广州人民广播电台风云962吗	Radio-Listen
提醒我明天下午一点去考试	Alarm-Update
赶紧给我看一眼飞往冰岛的航班哪天有票	Travel-Query
亚运会女子游泳比赛中日韩三国大战今年的亚运会比赛视频播放下	Video-Play
查询石家庄明天是不是下雨	Weather-Query
换一个我曾经记得那男孩	FilmTele-Play
我想知道这周闽南的平均气温	Weather-Query
8月1号是星期几	Calendar-Query
定一个大后天早晨7点给车做保养的闹钟。	Alarm-Update
有没有三年前的古装片给我看一个呢	FilmTele-Play
为我找到大陆奇幻题材的晴雅集	FilmTele-Play
问下你知道建党节是星期几吗	Calendar-Query
你赶快查查大前天是星期几	Calendar-Query
打开智能机器人，让它自动播报今天最新的天气预报	HomeAppliance-Control
我需要让洗衣机先暂停下	HomeAppliance-Control
看下是不是长春开往上海的特快列车进站没有啊	Travel-Query
把小型榨油机打开。	HomeAppliance-Control
马上告诉我6点有去本溪的特快吗	Travel-Query
我想继续观看完美的他的第二十一集	FilmTele-Play
岳阳市周三需不需要多加衣物防寒保暖。	Weather-Query
请收听一下频率是九五点九的联邦电台	Radio-Listen
三天后下午会高温多雨吗	Weather-Query
收听一零二点零的大厂人民广播电台	Radio-Listen
是否让风扇调成自然风吹吹	HomeAppliance-Control
把从王府井到天坛的步行方法告诉我一下吧	Travel-Query
请问今天是星期几	Calendar-Query
现在说一下14点有威海始发的长途大巴不	Travel-Query
放频率是一零六点九的火鸡电台	Radio-Listen
下周四南通的空气质量怎么样	Weather-Query
找杨毅做主持的那个电台就叫杨毅电台	Radio-Listen
放个比较轻松的90年代的网络歌曲吧	Music-Play
我需要看一部美国电影盗梦空间呢	FilmTele-Play
目的地马来西亚2月2号的机票查一下	Travel-Query
过一会告诉我4月5日是星期几	Calendar-Query
双十一零点预售的闹钟打开	Alarm-Update
我需要一首华晨宇的烟火里的尘埃	Music-Play
建军节是几月几号？	Calendar-Query
是不是能看其他日本的恐怖电影啊，贞子已经看过了	FilmTele-Play
请把明天晚上8点泡澡的闹铃设置一下。	Alarm-Update
回答我星期日是哪天啊	Calendar-Query
现在帮我把中央空调切换到辅热模式吧	HomeAppliance-Control
找几个穿越火线游戏比赛的视频来看	Video-Play
现在把洗碗机切换到75℃高温除菌功能吧	HomeAppliance-Control
来一个如懿传的第三集可以不可以	FilmTele-Play
立即播放葛东琪的定义	Music-Play
下个月湖南会下冰雹吗？	Weather-Query
韩国综艺节目交换的日子帮我找一下	Video-Play
放一首50年代的令人激情燃烧的歌曲	Music-Play
海王这个电影是不是能继续给我播放下呢	FilmTele-Play
你能不能记住4月10号10点通知我打开运维系统	Alarm-Update
帮我找到晚上8点的城市星光大道	Radio-Listen
能不能唱一首民谣四块五给我呢	Music-Play
农历的几月几号是端午节啊	Calendar-Query
马上查查星期五是今天吗	Calendar-Query
明年的情人节是周几	Calendar-Query
现在马上告诉我几月几号是这个礼拜日	Calendar-Query
丽江的空气质量稳定吗	Weather-Query
播放大秦赋	FilmTele-Play
来几首王力宏欢快的歌曲	Music-Play
国产动漫魔道祖师帮我找出来	Video-Play
明天苏州空气质量怎么样	Weather-Query
接着上次孙洪涛的股票分析收听	Radio-Listen
太原上周空气质量怎么样	Weather-Query
纪录片超级武器帮我查询一下	Video-Play
提醒我今天11点定外卖	Alarm-Update
查看一下5月1日是阴历多少啊	Calendar-Query
请每天早上提醒我对我妈妈说早安	Alarm-Update
明天上午的闹钟别让响了	Alarm-Update
悬疑片嘛播放万里追踪	FilmTele-Play
请在5月10号叫我去闯关	Alarm-Update
立刻播放薛之谦的专辑天外来物	Music-Play
帮我查看今天的中国梦主题纪录片啥时候进行吧	TVProgram-Play
播放摇滚歌神崔健的一无所有	Music-Play
台湾美女林志玲的剧给我播放吧	FilmTele-Play
能否帮我看一看12月18日是农历10月初5还是10月初6呢	Calendar-Query
我想让你把冰箱给关机，我要出门几天	HomeAppliance-Control
5月27日的怪鸟博士我莲藕认输了这个讲解植物大战僵尸的视频再给我播放一次吧	Video-Play
能帮我看一下到长沙最快的火车是哪趟	Travel-Query
我需要一条去警察局的最快路线	Travel-Query
我想看今年到今天为止播放量最高的古装剧	FilmTele-Play
空调风速调小多降点儿	HomeAppliance-Control
城市之音四川台FM102点6周一到周五6点到7点赵青城市小太阳	Radio-Listen
顺序播放专辑你一定要幸福里的歌曲	Music-Play
有没有颖儿今年上的电视剧给我看一个	FilmTele-Play
几月几号是关门节	Calendar-Query
我需要知道星期一是多少号呢	Calendar-Query
缅甸的独立日是周几	Calendar-Query
自动打开个7点的闹钟提醒我去买晚饭哦	Alarm-Update
明天是星期五吗	Calendar-Query
告诉我昨天到底是星期几	Calendar-Query
这回南天地太湿了，帮我开下空气除湿器吧	HomeAppliance-Control
上次听过的小提琴演奏的西班牙语歌放一下	Music-Play
二胡曲子二泉映月来放一下吧	Music-Play
下个月多少号是中秋节	Calendar-Query
能不能给我一条坐公交去超市的路线	Travel-Query
今年的国庆节是星期几	Calendar-Query
调到FM96.5，要王佳主持的阳光地带	Radio-Listen
找部赵丽颖霍建华演的奇幻片花千骨看看	FilmTele-Play
能调到有李静主持的都市之声吗	Radio-Listen
洗衣机使用完了关机	HomeAppliance-Control
找到并且播放何炅和黄磊参加过的向往的生活	FilmTele-Play
很想看俄罗斯的电影推荐视频随便播一个给我	Video-Play
我需要看杨延东2021年演出的剧呢	FilmTele-Play
长沙气温变化大吗	Weather-Query
23号到佳木斯的火车票还有吗	Travel-Query
有点赶时间，帮我把电饭煲切换到快煮饭模式	HomeAppliance-Control
好无聊，想看下电视，打开电视机吧	HomeAppliance-Control
阴历的6月初3是礼拜3还是礼拜4	Calendar-Query
交通类的重庆交通电台播放一下吧	Radio-Listen
随机能来一首民谣不	Music-Play
告我今天银川的穿衣指数	Weather-Query
下星期五是端午节吗？	Calendar-Query
贺岁的话那就请给我播放西游降魔篇	FilmTele-Play
收听频率是一零一点一的联通新势力男生宿舍	Radio-Listen
我想知道6月25日去岳阳最便宜的汽车是哪一趟。	Travel-Query
现在给我放康乐的每日资讯电台节目	Radio-Listen
请随机播放专辑墨镜里的歌	Music-Play
你好，打开3月份英国的舞台剧看一看	Video-Play
请你在明天7:15叫我买圆规和套尺	Alarm-Update
我想把空调关了。	HomeAppliance-Control
苏州近两天有雨吗	Weather-Query
李晨和张译演的好家伙播放一下	FilmTele-Play
郭敬明导演、杨幂主演的电影帮我找一个播放	FilmTele-Play
我要听胡凡主持的凡事想开点	Radio-Listen
中国演员肖战的剧给我来一个	FilmTele-Play
学习穿搭视频播放出来	Video-Play
沈腾主演的飞驰人生等一下播出来	FilmTele-Play
现在开始循环播一下茅屋为秋风所破歌这首诗	Audio-Play
今天有没有什么国际大新闻，放来看看	Video-Play
我能继续收听一下频率是一零七点三的呼吸决定电台吗	Radio-Listen
今天上海的空气质量好吗	Weather-Query
空气净化器可以帮我打开吗	HomeAppliance-Control
我已经开始听海洋之息这首钢琴曲了	Music-Play
现在给我放傅淳的向往的生活	Radio-Listen
端午节农历多少号	Calendar-Query
我要去阳曲县怎么走	Travel-Query
大陆热播剧蒋欣主演的小舍得放一下	FilmTele-Play
给小朋友放肖玉主持的多喜欢你	Radio-Listen
我要听东宫里的插曲爱殇	Music-Play
我想知道天津到北京的大客已经到站了吗	Travel-Query
播一下晚上22点更新的中流击水的介绍视频	Video-Play
我想随机播放一首许魏洲唱的歌。	Music-Play
可以设置成连续20天提醒我跑步吗	Alarm-Update
给我找一下古筝伴奏版的卷珠帘停一会	Music-Play
三月初二是几号啊	Calendar-Query
拜托就查查端午节是不是星期一	Calendar-Query
单曲循环speak low	Music-Play
随便播一个2021年晚上20点更新的动漫	Video-Play
今年的立夏是几月几号	Calendar-Query
我想看2015年凤凰传奇和筷子兄弟在央视春晚一起唱的最炫小苹果的视频	Video-Play
那个彩虹的重力我要看	FilmTele-Play
洗碗机运行速度减慢了，给我关掉它。	HomeAppliance-Control
马上搜一下11月1日是什么节日	Calendar-Query
随便播放一首专辑环绕里的歌	Music-Play
请帮我将2月10号的提醒改成1月15号提醒	Alarm-Update
给我找一下到天安门的路	Travel-Query
今天的日期是多少	Calendar-Query
我要听一首2020年的英文歌曲呢	Music-Play
关晓彤和吴磊演的什刹海马上给我放	FilmTele-Play
告诉我明早7点绍兴的室外湿度	Weather-Query
帮我关闭热水器	HomeAppliance-Control
我想你现在给我播一个新加坡的2020年上的喜剧	FilmTele-Play
从长沙到武汉的汽车票价格是多少。	Travel-Query
查找并播放快乐大本营	Video-Play
你能不能给我播放一下薛之谦的丑八怪呢	Music-Play
播放王冠主持的经济之声	Radio-Listen
打开扫地机器人	HomeAppliance-Control
查询未来一周江南会大幅度降雨吗	Weather-Query
帮我查一下今年的元旦是周几	Calendar-Query
打开投影仪，我想看最火的一部剧	HomeAppliance-Control
将电烤炉调到最大。	HomeAppliance-Control
我需要听频率是一零一点四的天津人民广播电台经济台	Radio-Listen
8点到底有没有上海来重庆的飞机	Travel-Query
重播一下下午4点的和平精英游戏讲解	Video-Play
请以后每天23:36提醒我睡觉	Alarm-Update
赶紧看看明天10点飞韩国的机票还有没有了	Travel-Query
我想播放陈赫出演的唐人街探案	FilmTele-Play
30号下午2点跟朋友去汗蒸的闹钟帮我定一下吧。	Alarm-Update
我想烤牛排，帮我让蒸烤箱切换到热风+蒸汽模式吧	HomeAppliance-Control
给我找一个阴阳师抽卡的视频	Video-Play
中国的演员肖战的古装剧来一个看看	FilmTele-Play
赶紧给我随机来一首周杰伦的歌	Music-Play
可以把空调风速调快些不	HomeAppliance-Control
青春电影，许光汉主演的你的婚礼	FilmTele-Play
电饭煲温度太低了，帮我升温	HomeAppliance-Control
2014年的胡彦斌当爱已成往事播放一下吧	Music-Play
播放一会仙剑三的主题曲给我听听吧	Music-Play
帮我找下悬崖之上的音乐视频吧	Video-Play
958交广书吧快给我帮放一下	Radio-Listen
前天武汉是雨天吗	Weather-Query
播出12点的王者荣耀巅峰赛	Video-Play
查一下上海飞往深圳的机票还有几张	Travel-Query
明天要去青岛出差，那边天气多少度	Weather-Query
播放九十年代的涛声依旧，不要翻唱的	Music-Play
哪天是中元节	Calendar-Query
来一个日本动漫名侦探柯南呢	FilmTele-Play
帮我记一下4月30号提醒我开发票	Alarm-Update
我要听一首林俊杰2014年发行的歌曲呢	Music-Play
是不是能给我来一首12年的歌曲呢	Music-Play
播放一首欧美新歌	Music-Play
想听怀旧音乐广播老猫主持的音乐节目哈	Radio-Listen
给我看看星期二是农历几月几号呀	Calendar-Query
播放一个孔刘主演的电视剧的介绍视频	Video-Play
可以只删除5月号到7号的备忘录吗	Alarm-Update
播放动听968电台的快乐一周	Radio-Listen
请播放一首刘欢老师的歌，那首都行	Music-Play
找一下何炅和谢娜主持的2018年的快乐大本营	Video-Play
查下后天富士山会下雪吗	Weather-Query
从中关村到学府路具体怎么走	Travel-Query
随机来首睡前听的应景的歌曲吧	Music-Play
明天的时候告知我准备好文具	Alarm-Update
8月5日是星期几	Calendar-Query
后天多云还是阴天	Weather-Query
有90年代范冰冰出演的中国电影吗	FilmTele-Play
我能继续看一下三生三世枕上书吗	FilmTele-Play
麻烦帮我播唐嫣主演的燕云台	FilmTele-Play
植树节是今年的什么时候	Calendar-Query
帮我创建一个周五晚上7点和朋友喝酒的闹钟。	Alarm-Update
搜一下太原飞长沙的机票价格？	Travel-Query
用最大的风速 我说空调呢	HomeAppliance-Control
今天气温有点低，把饮水机温度调到70度。	HomeAppliance-Control
赶紧查查前天是哪个节日呢	Calendar-Query
现在我想知道开往青岛的复兴号出发了吗	Travel-Query
胡彦斌的太歌专辑全部播放一下	Music-Play
星期几是圣帕特里克节	Calendar-Query
大理的空气质量保持良好吗	Weather-Query
帮我查看一下中秋节是不是星期3	Calendar-Query
我想继续听一会频率是一零零点二的江门电台	Radio-Listen
马上要看2016年英国家庭题材电影海蒂和爷爷	FilmTele-Play
我想听奈何里面的歌，随机一首就行	Music-Play
不是综艺是电视剧非诚勿扰	FilmTele-Play
麻烦帮我找个正放昆曲的曲艺电台听	Radio-Listen
是不是能帮我找一个今年新发的古典乐	Music-Play
我真的想知道飞巴西的飞机是今天的吗	Travel-Query
能给我收听一个频率是九七点七的第一财经广播频率吗	Radio-Listen
我要听频率是九七点五的情感电台	Radio-Listen
可以将空调设置为睡眠模式不	HomeAppliance-Control
提醒一下我后天晚上日语课	Alarm-Update
明天晚上8点有山河令演唱会直播帮我定一个闹钟	Alarm-Update
你可以帮我把5月20号三点的那个备忘录打开吗？	Alarm-Update
到公共汽车站的路线找一下	Travel-Query
速度看一看青年节是不是星期一	Calendar-Query
我要从上海飞北京坐晚上九点的飞机	Travel-Query
想看美国NBA球赛	Video-Play
你能帮我只删除9点到10点闹钟么	Alarm-Update
你现在能不能告诉我国庆节是几月几号啊	Calendar-Query
我要查周二去哈尔滨的火车票。	Travel-Query
去年抖音最火的神曲随机一首听吧	Music-Play
帮我看看大后天是星期几	Calendar-Query
王心凌的歌曲MV帮我搜索一下	Video-Play
帮我查找CCTV3的文化十分-2021-104期	TVProgram-Play
播放由周润发主演的电影英雄本色。	FilmTele-Play
查询丽江正在下大雨吗	Weather-Query
立即查找我国传统节日端午节是农历多少号啊	Calendar-Query
记录丽江湿度变化	Weather-Query
播放刘浩存出演的送你一朵小红花	FilmTele-Play
随便放一首2019年春晚的人气歌	Music-Play
调出FM93.4上海新闻广播	Radio-Listen
设置下个月10号上午10点去大理度蜜月的闹钟。	Alarm-Update
马上播放5月14日的杭州西湖音乐节的视频	Video-Play
郑州明天空气质量怎么样	Weather-Query
预约明天八点洗衣吧	HomeAppliance-Control
农历几月几日是春节	Calendar-Query
农历什么时候是诺鲁孜节	Calendar-Query
到衡阳的13号的火车票还有吗	Travel-Query
立刻把吴磊演的沙海给我播放一下行不行	FilmTele-Play
帮我关闭车库自动门	HomeAppliance-Control
西宁的穿衣指数怎么样	Weather-Query
准备播放赵英俊的送你一朵小红花	Music-Play
将明天上午7点喝水的行程设定好。	Alarm-Update
能不能来一个频率是九四点六的佛山人民广播电台真爱频道	Radio-Listen
花朝节是星期几	Calendar-Query
我不是药神这个2018年上的电影给我播放一下可以吗	FilmTele-Play
查询江西紫外线指数	Weather-Query
我已经连续播放四川广播电台的新闻联播了	Radio-Listen
我想听经济类的常州经济广播电台	Radio-Listen
我想看甄嬛传的第三集	FilmTele-Play
明年的除夕是星期几	Calendar-Query
我要听音乐类的宜昌交通音乐台	Radio-Listen
我要开车去银湖一号公馆	Travel-Query
循环收听一下新闻类的盐城人民新闻台	Radio-Listen
我想随机听一下REVISIT里的歌	Music-Play
马天宇郑爽演的流淌的美好时光给我放啊	FilmTele-Play
播一下晚上20点更新的壮志高飞抢先看	Video-Play
未来一周抚顺会不会下雨	Weather-Query
给我找下2013年张杰在深圳举办的演唱会的视频	Video-Play
不要删除8号到12号的备忘录	Alarm-Update
循环收听江扬主持的身边的声音	Radio-Listen
我就想看香港拍的动作片	FilmTele-Play
6月1号上午10点带着孩子去公园的闹钟设置一下吧。	Alarm-Update
我需要你帮我播放一个比较恐怖的电影	FilmTele-Play
福建下周多为风天吗	Weather-Query
祭敖包是星期几	Calendar-Query
我想步行去保百购物广场找找路	Travel-Query
打雷了，把电脑关了吧	HomeAppliance-Control
告诉我到北京最快的航班的时间	Travel-Query
给我播放4月26日荣升贵9后的第一抽的游戏视频给我回放下吧	Video-Play
打开用电吉他演奏的海阔天空，要纯音乐版的那个哦	Music-Play
快帮我定一个周末晚上8点跟闺蜜一起去游泳的闹钟。	Alarm-Update
创建一个30号抢车票的日程	Alarm-Update
找一个2019年经典励志的纪录片来看	Video-Play
我想看美国歌手泰勒2018年在日本举行演唱会的视频	Video-Play
我看下英雄联盟竞技赛5月4号视频回放	Video-Play
2020年播出的终极笔记可以播放第五集不	FilmTele-Play
帮我将风扇风级调为5级吧	HomeAppliance-Control
我想听频率是一零一点八的武汉人民广播电台文艺台呢	Radio-Listen
帮我调到湖南广播电台，我要听新闻	Radio-Listen
圣诞节是什么时候	Calendar-Query
请帮我转到山东农科查看看现在播放的一切为了群众	TVProgram-Play
听不清啊电视音量开大吧	HomeAppliance-Control
预约一下明天八点洗衣吧	HomeAppliance-Control
请帮我查询国庆节是10月几号	Calendar-Query
我想看王者荣耀104段野王的教学讲堂可以吗	Video-Play
十分钟之后查一下有没有去北京的高铁	Travel-Query
查找下周日下午两点半去西安的汽车	Travel-Query
这几天桐城那边空气质量好点儿没	Weather-Query
张国荣的港片色情男女播放吧	FilmTele-Play
给我找出来刘兰芳讲的杨家将全传听听	Audio-Play
接下来我要听张哲瀚的光	Music-Play
查询从大阪到东京的船票	Travel-Query
加祺的好友运动营找一下	Radio-Listen
我要听朱来生的交通新闻调一下	Radio-Listen
胡歌的仙侠剧可以来一个播放一下吗	FilmTele-Play
找西藏康巴话广播是方言台听今日关注	Radio-Listen
Famille的Génération Goldman单曲循环	Music-Play
我说你暖气给我关闭	HomeAppliance-Control
开启洗衣服30分钟洗衣功能吧	HomeAppliance-Control
设置明天八点的闹钟	Alarm-Update
请播放何文彪演唱的太阳岛上	Music-Play
义务昨天是不是下冰雹了	Weather-Query
调到周六日的城市最摇摆	Radio-Listen
循环听一下经济类的财政电台	Radio-Listen
昨晚晋城下冰雹了吗	Weather-Query
调到江苏财经广播电台，我要听新闻	Radio-Listen
帮我打开洗衣机，我要洗羽绒服	HomeAppliance-Control
你可以将闹钟设置成工作日9点吗？	Alarm-Update
七十年代边疆的泉水清又纯播放	Music-Play
告诉我端午节是农历几月几日	Calendar-Query
现在想看60年代的推理剧	FilmTele-Play
拉萨明天紫外线强吗	Weather-Query
放一下张靓颖在2019年春节晚会上唱歌的视频	Video-Play
我想知道明天去青岛的飞机票	Travel-Query
给我定周一早上4点的闹钟	Alarm-Update
听周六城市越洋疯就潘纳主持的	Radio-Listen
夏之旅能不能单曲循环下去呢	Music-Play
我想把二楼的灯关掉行嘛	HomeAppliance-Control
迪丽热巴的长歌行有幕后花絮么，放来看看	Video-Play
我想看2018年的偶像剧看看呢，类似三生三世那种剧就行	FilmTele-Play
查找大学英语的教学视频	Video-Play
我想听城市随身听张舒主持的快点儿12点就结束了	Radio-Listen
给我播放今年完整版的特效吃鸡系列游戏视频吧	Video-Play
昨天北京下雨了，昨天的降水量有多少毫米	Weather-Query
11点有没有沈阳飞莫斯科的飞机	Travel-Query
将空调切换为自动升降温模式	HomeAppliance-Control
我想看下有关中国历史的记录片	Video-Play
搜一下戚薇演的你好安怡	FilmTele-Play
丁适的新节目新闻深处听听怎么样	Radio-Listen
设置闹钟明天9点带遮阳帽出门	Alarm-Update
随便给我放一个今天的足球比赛来看看	Video-Play
海南下午的温度是多少	Weather-Query
把周深的大鱼帮我单曲循环好吗	Music-Play
放纪录片人世间的花絮	Video-Play
今年中秋节是什么时候啊	Calendar-Query
2021年在中国播出的山河令的花絮帮我播放吧	Video-Play
空调制冷模式定时两个小时	HomeAppliance-Control
那设一个八点半和8:40的闹铃	Alarm-Update
我想听一首近期出的钢琴曲	Music-Play
把昨天的英雄联盟比赛给我回放一下	Video-Play
从西安到武汉坐高铁要几个小时？	Travel-Query
我马上就要关掉空调	HomeAppliance-Control
放白眉大侠	FilmTele-Play
经济类的天津人民广播电台经济台现在收听一下吧	Radio-Listen
播放动漫英雄再来的全部剧集按顺序播放	Video-Play
我想看一个比较轻松快乐的美剧	FilmTele-Play
想搜索火箭少女101在2019年12月31日参加的湖南卫视跨年演唱会的视频	Video-Play
让洗衣机开始脱水吧	HomeAppliance-Control
麻烦找到去新华第二小学的路	Travel-Query
三生三世枕上书第二十集给我播放一下呢	FilmTele-Play
播放吹打乐丰收锣鼓庆祝一下	Music-Play
是不是现在能立刻给我播放一下迪丽热巴新剧的第一集	FilmTele-Play
放葫芦兄弟精彩合集给小孩看	Video-Play
来收听一下频率是八八点七的中国国际广播电台吧	Radio-Listen
关于三国的歌曲随机来一个吧	Music-Play
查询明天广州会持续降雨吗	Weather-Query
查询播放周四长春是阴天吗	Weather-Query
我需要听一个频率是一零零点六的宜昌经济台呢	Radio-Listen
5月09日发生的八旬老人破世界纪录的新闻视频给我回放下吧我想看	Video-Play
提示我明天中午12点蒸米饭	Alarm-Update
农历的哪天是圣瓦伦丁节	Calendar-Query
现在请给我放从威的电台节目挪威森林	Radio-Listen
下午山西有雨吗	Weather-Query
调个60年代的藏语歌曲吧	Music-Play
听听无锡都市生活广播的名医零距离在FM88点1	Radio-Listen
请帮我找个正放五典坡的曲艺电台听	Radio-Listen
放一下一本不说话的书这个故事吧	Audio-Play
给我找宫崎骏的采访视频	Video-Play
给我导航去广州的高速路线	Travel-Query
建军节是什么时候	Calendar-Query
查询宁波明天紫外线会偏高吗	Weather-Query
能不能继续播放我上次看的如懿传呢	FilmTele-Play
薛之谦的专辑里的歌随机放一个可以吗	Music-Play
今年的国庆节是周几请立即告诉我	Calendar-Query
陈奕迅一首歌一个故事里面的歌曲随机来一首	Music-Play
播放中央人民广播电台的华夏之声	Radio-Listen
帮我播放一部现代的偶像剧良辰美景好时光	FilmTele-Play
跟我说说明天山东北部紫外线指数怎么样	Weather-Query
独步天下播放一下接上回啊	FilmTele-Play
张学友90年代专辑真爱里面的歌曲随机来一个听吧	Music-Play
FM96点4如歌的岁月请帮我播放一下	Radio-Listen
单曲循环播放潘玮柏的反转地球	Music-Play
看一看建党节是星期几	Calendar-Query
播放大陆片外交风云，这个剧把六十年代的外交历史形象的演绎出来了	FilmTele-Play
忏悔节是星期几	Calendar-Query
