找出明天挪威去冰岛的所有航班信息。	Travel-Query
空调风太小了调大一点	HomeAppliance-Control
查询明天太原可以穿什么	Weather-Query
立刻找到 频率是九零点零的第三套节目文艺调频给我听听	Radio-Listen
快帮我设置一个明天早上9点出门的闹钟	Alarm-Update
明年的端午节是星期几	Calendar-Query
我想继续看杨幂的剧呢灵异题材的	FilmTele-Play
现在告诉我几月几号是农历的3月25	Calendar-Query
空调温度调高些	HomeAppliance-Control
预约广安青年广播电台的节目青年说	Radio-Listen
每周三提醒我去参加晨祷改成每周四提醒	Alarm-Update
你能给我看一会2020年上的喜剧电影吧	FilmTele-Play
查找在中央台播出的廊桥遗梦	TVProgram-Play
你能继续给我播放一下战争片麻雀吗	FilmTele-Play
明天天气好吗能春游去不	Weather-Query
可以点播一首今年最火爆的抖音歌曲么	Music-Play
我想把电视机关了，有点吵。	HomeAppliance-Control
到贺州市八步区的路找下	Travel-Query
空调风速太高啦小一点	HomeAppliance-Control
给我定个明天傍晚的闹钟	Alarm-Update
宋捷演唱的民谣我会想起你播放	Music-Play
郭晶晶的跳水运动比赛视频播来看一下	Video-Play
播放爱情进化论	FilmTele-Play
找一个韩国那边演员李敏镐的电视剧看看可以吗	FilmTele-Play
给我找到FM88点7的崇明区人民广播电台	Radio-Listen
张学友1984年的大地恩情播放呢	Music-Play
现在帮我开启一下洗衣机的单烘干模式吧	HomeAppliance-Control
立即搜索邢台紫外线指数	Weather-Query
查一下下午三点到虹桥机场的汽车票	Travel-Query
开往佛山的特快列车出发了吗	Travel-Query
帮我查下清明节是星期几	Calendar-Query
查一下龙海15号的气温	Weather-Query
随便播放一首马头琴演奏的音乐	Music-Play
今天湿度有点低啊，帮我打开取暖器吧	HomeAppliance-Control
我需要看一个新加坡的爱情偶像剧	FilmTele-Play
要出去了，帮我把家里的中央空调关上	HomeAppliance-Control
查下日历大前天是农历多少	Calendar-Query
落霜循环播放，尘AH的	Music-Play
拉萨明天是不是会下雪？	Weather-Query
可以帮我打开空气净化器吗	HomeAppliance-Control
我现在就需要播龚俊演的青春偶像剧	FilmTele-Play
3月20是农历的哪天	Calendar-Query
预约两小时后关闭风扇可以吗	HomeAppliance-Control
我想听开浩御书房的疯狂的投资	Radio-Listen
怎么才能到汉口火车站啊	Travel-Query
帮我查询明天珠海室外温度多少度	Weather-Query
设置一个下午6点去拿快递的闹钟	Alarm-Update
银顶花园怎么走啊	Travel-Query
回放上周五刺激战场竞技赛的视频	Video-Play
明天去抖音开直播的提醒请取消了	Alarm-Update
帮我设定一个今天晚上8点跟朋友打游戏的闹钟。	Alarm-Update
这几天要去太原查一下那边空气湿度多少	Weather-Query
打开健身房的空调	HomeAppliance-Control
给我把空调风速调大	HomeAppliance-Control
今年冬天江门还会不会下雪了	Weather-Query
4:20出发去上海，到时间告诉我哦	Alarm-Update
1点75倍速放刘佩琦主演的谷文昌	FilmTele-Play
请找到中国之声播放千里共良宵	Radio-Listen
张铁林的古装剧随便看一个吧	FilmTele-Play
看爱情剧恶魔少爷别吻我	FilmTele-Play
我要单曲循环喜欢你。	Music-Play
帮我查一查广州飞北京的机票要多少钱。	Travel-Query
可不可以帮我把加湿器开成夜间模式呢	HomeAppliance-Control
请给我播放2017年美国电视剧女超人第三季的花絮	Video-Play
查查后天的农历是几号	Calendar-Query
能不能给我打开金刚模式上线的游戏解说视频	Video-Play
收听频率是九七点四的古典也流行	Radio-Listen
给我播放李安导演的少年派的奇幻漂流电影吧。	FilmTele-Play
将5月1号上午的提醒修改成下午6点提醒	Alarm-Update
4月18号是农历的哪天	Calendar-Query
帮我播放卓依婷的明天会更好	Music-Play
我想看2008年马琳波尔的乒乓球比赛视频	Video-Play
我要查6月1日去武汉的靠窗硬座。	Travel-Query
我想听一下林俊杰的美人鱼	Music-Play
把电风扇风速调快一档。	HomeAppliance-Control
10分钟后建立提醒退出抖音	Alarm-Update
频率是九一点一的天津人民广播电台生活台收听一下吧	Radio-Listen
定好了明天上午6:20去死文佳拿快递的日程了吗	Alarm-Update
今天适合听这是我一生中最勇敢的瞬间摇滚的那个	Music-Play
请在10:50提醒我该睡觉了	Alarm-Update
把风扇调整为自然风可以不可以	HomeAppliance-Control
拨到春叔电台主持的那个频道	Radio-Listen
请给我续听春天的春天电台	Radio-Listen
播放今天的王者荣耀的解说视频	Video-Play
能给我把2021年的爱上男声FM放一下啊	Radio-Listen
凝视深渊这部纪录片是英国的吗给我播放吧	Video-Play
想听奥斯丁的傲慢与偏见英文版	Audio-Play
济南发往沈阳的大巴明天有没有票	Travel-Query
要粤语电台就听南粤之声吧那好像是粤语的	Radio-Listen
今天在韩国报道的抑郁逼进青少年这个新闻视频再给我回放下吧	Video-Play
半个小时后提醒我要做饭	Alarm-Update
我喜欢听山河令里面的歌曲呢，随机来一曲听	Music-Play
30年代专辑秋水伊人有个老歌我问你，马上播放	Music-Play
我想顺序播放10首范世錡专辑假装里的歌。	Music-Play
谁让你把空调风调小了大一点儿	HomeAppliance-Control
帮我把空调风调小一点呀	HomeAppliance-Control
明天辽宁会下雪吗？	Weather-Query
将闹钟设置成五月五号下午六点	Alarm-Update
帮我播一下科幻剧酋长的男人最后一集	FilmTele-Play
放几条陈奕迅2020演唱会唱歌的视频	Video-Play
我想随机听一下抖音神曲	Music-Play
我想看U21青年男子篮球锦标赛9月16日的八一富邦VS新疆广汇那一部分	Video-Play
播放一下国创动漫狐妖小红娘	Video-Play
马上报一下今年的阴历3月2是不是星期4呀	Calendar-Query
听上海戏剧曲艺广播唱戏曲	Radio-Listen
想听老狼唱的同桌的你了，放一下	Music-Play
能帮我播放一首覅忒好里的歌曲不	Music-Play
这时候请帮我关闭电扇吧	HomeAppliance-Control
请告诉我答案阴历的几月几号是12月5日啊	Calendar-Query
你能把杜月媚主持的中华之声播放出来吗	Radio-Listen
新增备忘录明天12点提醒我上王者	Alarm-Update
2020年悬疑电视剧你是她拨打一下吧	FilmTele-Play
找生活台听山西健康之声的健康达人	Radio-Listen
查一下青岛到烟台的大客到站了吗	Travel-Query
请把明天下午两点去听相声的闹铃设置一下。	Alarm-Update
打开爱奇艺回放昨天的斗罗大陆花絮	Video-Play
明天是什么节假日吗	Calendar-Query
请给我播放2019年美国电视剧硅谷第六季的幕后故事	Video-Play
快点播放一下王易阳的专辑说好分手不会哭	Music-Play
鬼吹灯系列想看2016年靳东的精绝古城	FilmTele-Play
导航去南三环看看还堵车吗	Travel-Query
播放专辑庸人自扰，王理文的	Music-Play
能不能播放韩剧太阳的后裔给我看啊	FilmTele-Play
帮我定一个早上7点的闹钟	Alarm-Update
我们要看张艺谋拍的谍战片悬崖之上	FilmTele-Play
我在10月1号到10月7号期间的计划保存一下	Alarm-Update
帮我创建一下周末上午8点买电动车的闹钟。	Alarm-Update
怎么这么冷，告诉我下取暖器温度是多少呀	HomeAppliance-Control
光复节是星期几	Calendar-Query
把我下午1:20的日程删除	Alarm-Update
音乐电台帮我找一个重庆音乐广播就可以	Radio-Listen
找个曲艺电台正放三滴血的	Radio-Listen
打开腾讯视频我要看邓伦参加的极限挑战第七季	Video-Play
我想看一个范冰冰90年代拍的电视剧呢	FilmTele-Play
帮我找那场鲁班七号把百万主播打傻的直播	Video-Play
播放周深的英文歌	Music-Play
我想知道开原今天是不是要多加衣物防寒保暖。	Weather-Query
搜索7月25日去阿姆斯特丹的经济舱价格。	Travel-Query
给我看看北京飞上海的飞机已经起飞了吗	Travel-Query
帮我导航一下合肥到郑州的路线怎么走。	Travel-Query
前天平潭气温多少	Weather-Query
快点儿帮我找一下最近的公厕怎么走	Travel-Query
中央3套播出的综艺喜乐汇帮我预约播出一下	TVProgram-Play
现在给我定一个周一10点的闹钟	Alarm-Update
帮我播放正在直播的国际足球赛场-20-21赛季意甲联赛第38轮1	TVProgram-Play
快点查下上海飞往马来西亚的航班哪天有票	Travel-Query
你刚才有提醒我去取快递吗？	Alarm-Update
我想知道洛阳今晚需不需要多加衣物。	Weather-Query
感觉昨天的湿度会不会比今天高	Weather-Query
今天中午紫外线指数是否会继续上升	Weather-Query
能把空调风调低点吗	HomeAppliance-Control
继续放高尔基的小说在人间的第二章	Audio-Play
观看个2019年香港悬疑电影	FilmTele-Play
军事题材电视剧有吗播放一部让我感受一下	FilmTele-Play
立即让我知道西安飞往广州的机票还有几张	Travel-Query
帮我看一看订一张最快飞重庆的商务舱机票	Travel-Query
脸上长痘痘了要用什么护肤品	Other
组图陈豪出席手机活动周汶不问妹妹感情事	Video-Play
明天天气晴朗吗，想带孩子去花园玩儿	Weather-Query
听一听保定人民广播刘聪的节目快点儿给我调	Radio-Listen
想听英文歌儿了给我播到FM88点7	Radio-Listen
给我放一下我存在你的所有角落这个小说	Audio-Play
我要听北平无战事那个原著	FilmTele-Play
辽阳将会持续大风天气吗	Weather-Query
乐思购物直播节目是在今天十八点播放吗帮我看下	TVProgram-Play
小一点空调风4就够	HomeAppliance-Control
昨天大理刮风了吗	Weather-Query
适合运动的歌曲来一首吧	Other
请收听频率是一零七点八的大连生活频道	Radio-Listen
而梁朝伟站在餐厅外与宾客们寒暄几句后就与主人家婆婆握手道别	Alarm-Update
播放2020年春晚赵本山宋丹丹的小品来听一下	Video-Play
帮我找找今天有什么适合儿童看的纪录片	Video-Play
给我慢速播放月光变奏曲第十集	FilmTele-Play
我喜欢张艺谋导演的菊豆	FilmTele-Play
现在性能最好的AGP插口的显卡是哪一款	HomeAppliance-Control
古巴解放日是几月几号	Calendar-Query
明天是否是大风蓝色预警	Weather-Query
打开卡通播放一下昨天的熊出没之丛林总动员	Video-Play
给我放一个李商隐的诗词吧	Audio-Play
频率是一零零点五的心里有个你电台立刻继续收听吧	Radio-Listen
广电总局关于上星频道开办道德建设栏目的通知	Radio-Listen
给我放频率是九零点零的辽宁资讯可以吗	Radio-Listen
花朝节是几月几号	Calendar-Query
帮我把蒸烤箱切换到3D热风模式	HomeAppliance-Control
放一下蔡徐坤的最新出的情人	Music-Play
那我做你男朋友好不好	Other
帮我搜索中国的阴历1月12是哪一天呢	Calendar-Query
给我播放一个郭德纲相声听	Audio-Play
立刻帮我建一个备忘录2月3号开会	Alarm-Update
王祖蓝将刘子千在中歪嘴摆头兼眨眼的夸张表情学到足十分爆笑	Music-Play
如果一个男的真的爱你	FilmTele-Play
设置一个今天下午3点交付数据的备忘录	Alarm-Update
哈尔滨的空气质量如何	Weather-Query
打开中央14，给我女儿找下西游记	TVProgram-Play
帮忙把空调的风速调节到自动模式	HomeAppliance-Control
从香山到天坛公园如何走红绿灯比较少呢	Travel-Query
微微一笑很倾城的有声漫画帮我播一下	Video-Play
换了人间-（四套）-16/40正在CCTV4直播观看一下吧	TVProgram-Play
播放最新京都天气状况	Weather-Query
我需要收听教育类的广东人民广播电台教育之声	Radio-Listen
新华路和健康路交叉口	Travel-Query
查看电影频道往期视频快递丘比特	Video-Play
下周3是农历的哪天	Calendar-Query
播放校园歌曲睡在我上铺的兄弟	Music-Play
看看给我订一张去南京的商务舱机票	Travel-Query
这时候帮我关掉摄像头吧	HomeAppliance-Control
想听张碧晨的星空剪影，帮我放一下吧	Music-Play
我需要知道义乌始发的飞机是几点的呢	Travel-Query
可是我没有开心的事啊	Other
给我循环放一下阿凡提的故事	Audio-Play
2020年上线的爱情剧可以播放一下吗	FilmTele-Play
帮我转到今天晚上六点的广西天气预报	Radio-Listen
打开电视切换到河北卫视	Radio-Listen
给我播一个斯蒂芬妮梅尔的惊悚小说暮光之城	Audio-Play
现在打开收音机	HomeAppliance-Control
放一首姜云升的说唱歌曲起点。	Music-Play
播放CCTV1正在直播的绝密使命	TVProgram-Play
九十年代邰正宵的《九百九十九朵玫瑰》播放	Music-Play
请在星期一早上8:00的时候提醒我回复马冬梅德消息	Alarm-Update
给我放一个英文版的篱笆国王	Music-Play
调到山海屯青少年广播电台 频率是九零点三	Radio-Listen
提醒我明天记得带伞	Alarm-Update
苍蝇头造型出镜贾斯汀被吓瞠目结舌图	Video-Play
请将风速调至4好吗	HomeAppliance-Control
昨天的电影台播的逗吧逗把街我没看到想再播放一下	TVProgram-Play
我要循环播放龟兔赛跑这个故事	Video-Play
我想随机播放60年代的爵士乐	Music-Play
可以帮我找找今天播放的盛唐幻夜在哪个吗我想看下	TVProgram-Play
中国新闻在哪个电视频道播出查询一下	Radio-Listen
想看百姓财经，帮我打开公共吧	Radio-Listen
中午11点40分的DV现场给我回放下吧	Video-Play
大约是爱能播放吧	FilmTele-Play
给我播放一下去年中国抗击新冠疫情的视频	Video-Play
阿忠不离不弃是不是让对婚期更确定	Radio-Listen
去龙门最近的路怎样走	Travel-Query
通知我去看电影在8号的时候	Alarm-Update
山东周三会刮风吗	Weather-Query
最爱听中国古风专辑踏山河，要原唱是七叔的	Music-Play
现在驾校报名费多少钱儿	Other
能否提醒我取衣服在1小时之后	Alarm-Update
继续放频率是九零点零的常州人民电台	Radio-Listen
帮我查看一下去五一公园的路线吧	Travel-Query
帮我查一下到银川的高速路线	Travel-Query
定一个5点半的闹钟	Alarm-Update
给我播托马斯.哈里斯的小说沉默的羔羊俄语版的	Audio-Play
下面给我播放一个故事了不起的火箭	Video-Play
广播剧将进酒帮我放一下	FilmTele-Play
我想看袁娅维中国好声音袁娅维pk吉克隽逸的视频	Video-Play
前年上线的古装剧找一个看看吧，庆余年那种或者类似香蜜都可以	FilmTele-Play
我要听周杰伦最近的歌曲呢	Music-Play
未来一周鞍山有没有雨啊	Weather-Query
告诉我后天的紫外线指数	Weather-Query
开车去萧绍路怎么走	Travel-Query
B站上的非正式会谈第六季的相关视频快点给我播放	Video-Play
回放上个礼拜三的江苏教育新闻。	TVProgram-Play
人日节是什么时候	Calendar-Query
BIGBIGWORLD歌词	Music-Play
给我空调风速减小减小	HomeAppliance-Control
郑要让大腕通过潜规则才能有资格在观众席上坐一下笑	FilmTele-Play
今年的愚人节是周几	Calendar-Query
编剧最终还是遵循了原着的精神	Other
空调风速调至4就行	HomeAppliance-Control
我能知道12点有牡丹江去哈尔滨的汽车吗	Travel-Query
闭上眼睛什么都不要想	Other
5月2日澳大利亚对印度发布“最严格”旅行禁令的新闻视频给我回放下吧	Video-Play
秦岭周六下冰雹吗	Weather-Query
23号牛乃糖在卡通正式开播了吗帮我看下	Video-Play
把卧室里的灯光调暗	HomeAppliance-Control
话说你们什么时候放假	Other
我真的很想看今年的和平精英解密系列的完整版视频给我打开下可以吗	Video-Play
让洗衣机开始漂洗好吧	HomeAppliance-Control
立刻找出来戴尔XPS 15的测评视频	Video-Play
你的快递我给你放在门卫了	Other
我想听频率是九七点四的北京人民广播电台音乐台	Radio-Listen
记得提醒我早上7点起床上班	Alarm-Update
让我看下2002年的乌龙闯情关里面的小鲜肉	FilmTele-Play
来一首由二胡大师王国潼演奏的二泉映月	Music-Play
循环播放童话故事夜莺	Music-Play
3月12号到4月10号的提醒不要在提醒了	Alarm-Update
想看寰宇地理，帮我打开科教健康吧	TVProgram-Play
帮我查询下室内湿度是多少吧	HomeAppliance-Control
请给我续播梦魇桃花的第十章节	FilmTele-Play
你为什么听不懂我说的呢	Other
锦州现在适合穿什么衣服	Weather-Query
快查查现在还有几点到南宁的汽车	Travel-Query
热水器现在调到恒温模式	HomeAppliance-Control
可以帮我看看今天的广西公共有什么电视剧看吗	TVProgram-Play
带货直播这么火的原因是什么	Video-Play
报一下中国的阴历1月1日是星期几呢	Calendar-Query
回放一下2020年5月9日周杰伦在海口开演唱会的视频	Video-Play
我想看今年最新最全的香肠派对游戏视频讲解	Video-Play
给我放一个天蚕土豆的网络玄幻小说	Audio-Play
我想要了解农历9月15是什么节日	Calendar-Query
给我找一个C罗的经典足球比赛来看	Video-Play
不要忘了6号建立提醒我改装房间	Alarm-Update
泼水节是农历的什么时候	Calendar-Query
下一个月星期几是感恩节	Calendar-Query
是否让空调温度再高一点呢	HomeAppliance-Control
记得提醒我10分钟后关电磁炉	Alarm-Update
你能给我放一下霍尊的卷珠帘现场版本听么	Music-Play
帮我播放单田芳讲的隋唐演义	FilmTele-Play
频率是八九点六的武汉人民广播电台交通台可以收听一下吗	Radio-Listen
千万别忘了提醒我明天下午3点要去西站坐车	Alarm-Update
麻烦帮我播放FM95点4海口旅游交通广播的节目	Radio-Listen
怎么从这里去故宫	Travel-Query
北京人民广播电台交通台这个交通类电台可以播放一下吗	Radio-Listen
空调调低百分之5到20度	HomeAppliance-Control
1月14号早上9点的闹铃你和我上好了吗？	Alarm-Update
请播放故事火龙爸爸戒烟记	Audio-Play
有点太热了，中央空调温度再调低点	HomeAppliance-Control
提前帮我打开卫生间的灯吧	HomeAppliance-Control
那个中国电视剧十宗罪的花絮播放一下吧	Video-Play
播放爱情电影你的婚礼	FilmTele-Play
谈及今年港姐是非多袁咏仪表示每年都有	TVProgram-Play
全文对郑秀文只字不提	Audio-Play
最快到上海的高铁车次是哪趟	Travel-Query
查询广西都市今天有什么好节目可以看	TVProgram-Play
放一个烽火戏诸侯的极品公子来听	Music-Play
朱茵及陈小春更是最后两位冲过终点	FilmTele-Play
重阳节是不是这周五	Calendar-Query
麻烦打开江苏影视的我在北京等你	Radio-Listen
今天的新闻说报是不是已经过了播放时间了帮我看下	TVProgram-Play
能否回放一下早上七点二十分的时事关提案吗我想看下	Video-Play
到广州清远车站公交站怎么坐车	Travel-Query
播放周杰伦2011年的歌吧	Music-Play
拿得起放不下的是筷子	HomeAppliance-Control
新浪娱乐讯韩庚玩游戏竟然还作弊亲手煮饺子献给韩庚迷	Video-Play
快点帮忙订三张明天早上飞长春的机票	Travel-Query
查询山西下周会大面积降雨吗	Weather-Query
报一下去往贵阳的高客发车了没	Travel-Query
不行她还得复习呢明年该考大学了	Alarm-Update
顺序播放米小圈上学记这个动漫吧	Video-Play
怎么没有看到我下载的QQ浏览器	Other
给我找个王昌龄诗吧	Music-Play
2021年央视跨年晚会上杨幂和周笔畅一起演唱了世间美好与你环环相扣的视频给我播放一下吧	Video-Play
播放一人之下中王也和张楚岚对战的片段	Video-Play
找一首2016年发行的古典歌曲给我听吧	Music-Play
你听过全球进化的有声小说吗	Audio-Play
我需要一首沈文裕的钢琴曲呢	Music-Play
查找哪个到丽江的火车用时最短	Travel-Query
重庆卫视为什么在凌晨播出新世界	TVProgram-Play
14号提醒我一下回学校打卡	Alarm-Update
播一个刘洋的洋洋电台	Radio-Listen
我活得好陈琳在九泉之下才放得下心	Music-Play
对于李宇春有望开工作室的消息有网友质疑此举是天娱的炒作行为	Alarm-Update
帮我调到财经节目直通公司	Radio-Listen
每天9点截图的提醒以后都不用再提醒了	Alarm-Update
刚拿下金钟影后的天心到这一刻都还不敢相信影后就是自己	Music-Play
我要看鬼畜剧场里的全明星手术室	Video-Play
天气要变热了，要准备薄一点衣服吗？	Other
周一下午三点会下雨吗？	Weather-Query
请播放明星类综艺向往的生活	Video-Play
开心消消乐通关的视频播一下	Video-Play
松哥梅姐帮帮帮今天九点重播吗我想看下	TVProgram-Play
除了李亚鹏决定退居幕后记者获悉王菲也对投拍影视剧产生兴趣	FilmTele-Play
帮我播一下路知行和魏超合作的广播剧	Audio-Play
能不能查查后天是个什么节	Calendar-Query
非常6+1-2021-20的直播视频回看一下	Video-Play
两名青年司机被警方带走	Other
我现在想听古典音乐阳春白雪笛子版	Music-Play
拨一零六六八八九九零零二观看成人激情视频	Video-Play
是不是能把有田龙的音乐之声播放出来	Radio-Listen
恋人重逢段奕宏再度倾倒	Music-Play
往期视频第二战场-2019-15在国防军事查看一下	Video-Play
就是我们当初在创作的时候就是以人物为主这是我们戏的最大看点	Other
现在开车去北京火车站快帮我找找路	Travel-Query
能否播放5月22日的今日西安吗	TVProgram-Play
仔细的看看龙岩开过来的高铁今天有票吗	Travel-Query
我偶像郭富城90年代的专辑由零开始，帮我单曲循环对你爱不完	Music-Play
韩国电影乐园之夜的预告片帮我找一下	Video-Play
给我找个柳宗元的诗词来播	Audio-Play
七天爱上你的大部分浪漫的爱情故事都是发生在这里	Audio-Play
继续播放吴京导演的战狼1	FilmTele-Play
空调的风速调低一点儿	HomeAppliance-Control
将明天上午10点去淘宝农场兑换礼品的提醒设置一下。	Alarm-Update
学校没大事本周六停一次课别来了	Alarm-Update
没事儿去大学好好读书哦	Other
我想听一首治愈系的钢琴曲呢	Music-Play
5月26上午播出的兵器面面观-2021-90回放一下	TVProgram-Play
定闹钟下午三点要提交手中的工作	Alarm-Update
明天上午的日程安排保存好	Alarm-Update
我想听郭麒麟岳云鹏的经典相声三大才子	Audio-Play
对话大医生是不是在十点二十分有回放呀帮我看下	TVProgram-Play
找一下1996年的朝廷剧宰相刘罗锅	FilmTele-Play
我想看3月28日周深在歌手当打之年唱的达拉崩吧的视频	Video-Play
来一首费玉清的千里之外听听	Music-Play
现在给我播一个英文版的格林童话吧	Audio-Play
请用英文放国王与鹤这个故事	Audio-Play
帮我查看从石家庄到上海的火车票时间	Travel-Query
最近南通有没有7级以上大风	Weather-Query
谁捡到瓶子聊会儿天呗	Other
别忘了明天还有个会要参加	Alarm-Update
熔炉是不是一部改变了国家法律的韩国电影	FilmTele-Play
南阳了哎他那都快儿闷死了	Weather-Query
如何走路去北京军事博物馆啊	Travel-Query
我想要看致我们暖暖的小时光	FilmTele-Play
明年的元宵节是啥时候	Calendar-Query
我想听一个小品献爱心	Audio-Play
将4月10号的提醒改成当天下午5点提醒	Alarm-Update
发往沈阳的大巴6月13日有没有票	Travel-Query
怎么坐公交去美食街	Travel-Query
找到I的时尚空间就袁博那个	Radio-Listen
记得提醒我晚上9点接老板回家	Alarm-Update
我想知道今年的春节是农历的什么时候	Calendar-Query
下周一二九号影片正式开机	Other
帮我设一个明天早上6点的提醒	Alarm-Update
想看下王者荣耀孙尚香的实战讲解	Video-Play
打开靳雷主持的经济之声	Radio-Listen
看来陈友的心情的确不错	Music-Play
回放刚刚在CCTV12结束播出的道德观察	TVProgram-Play
周末特供2021-316的视频回看一下	Video-Play
放英文版的鹊桥仙	Music-Play
在明天下午6点通知我去取书籍哟	Alarm-Update
明天要去开会，帮我看一下明天天气有没有雨好吗？	Weather-Query
创建下22号上午8点带孩子去跳舞的行程。	Alarm-Update
请查询播放明天有哪些地区下雨	Weather-Query
步行到南广场的路线	Travel-Query
查询明天江西紫外线会偏高吗	Weather-Query
经理人小美表示城城这次到成都休息其后便开始准备台湾个唱	Travel-Query
7月去大凉山适合穿什么衣服	Weather-Query
请播放著名小说装在套子里的人的法语版来听	Music-Play
收听频率是一零六点九的陈末电台	Radio-Listen
发短信给老妈告诉她吃饭	Alarm-Update
目的地是福建省离廉江怎么走	Travel-Query
推送下元宵节当天教育的经典节目	Alarm-Update
我想给单位职工办社会保险想问问你都需要些什么手续	Alarm-Update
请循环播放法语版的两个海岛	Music-Play
怎么去除硫酸钠中混有的碳酸钠	HomeAppliance-Control
来看看马主播在美丽的西藏是怎样享受他的生涯的	Video-Play
帮我找条到公司的路	Travel-Query
我还以为你不玩儿了呢	Other
明天下午9点的备忘录已经帮我取消	Alarm-Update
那是不然你有钱没地方给	Other
我要听用法语讲的顽皮的孩子的故事	Audio-Play
我想听悬疑小说莫尔格街谋杀案的德语版	Audio-Play
