唉你给我把温度调低就这屋空调的	HomeAppliance-Control
是不是能来一个大陆的历史剧不要偶像剧	FilmTele-Play
5月25日发布的英首相约翰逊明年7月结婚的新闻视频再给我放下	Video-Play
我需要你看下南昌昨天的湿度是多少	Weather-Query
能给我放一首凤凰传奇唱的最炫民族风吗	Music-Play
是否能把频率是九四点八的梅州电台继续听	Radio-Listen
我想试试蒸烤箱的纯蒸模式行不行呢	HomeAppliance-Control
我想看今天发生的新郎新娘婚车上吵架的视频	Video-Play
我一会儿就要听中央广播的文艺之声	Radio-Listen
给我打开台湾的爱情剧我可能不会爱你	FilmTele-Play
查一下8月1日是什么节日	Calendar-Query
找2020年12月20日英雄联盟比赛的视频来看	Video-Play
查查后天到底是几月几日	Calendar-Query
飞往悉尼的航班哪天有票呢	Travel-Query
今年的七夕节是周几	Calendar-Query
2021年全国女子体操锦标赛前三名的精彩片段视频给我回放一下吧	Video-Play
能来一个香港电影甜蜜蜜吗	FilmTele-Play
未来三天文登天气晴吗	Weather-Query
找一个吓人的日本恐怖电影看吧	FilmTele-Play
今年10月1号是星期几	Calendar-Query
想看美国爱情片怦然心动	FilmTele-Play
麻烦请告诉我知道春节应该是农历多少呀	Calendar-Query
详细播报明早大连的天气情况	Weather-Query
还能找到5月15日何必解说的只用一轮积分获得MV P的9游戏视频吗	Video-Play
赶快告诉我中国传统节日端午节是多少号啊	Calendar-Query
提醒我周日下午一点去练球。	Alarm-Update
是否能够给我播放一个娄艺潇主演的爱情公寓呢	FilmTele-Play
今天有佛山始发到珠海的大巴吗	Travel-Query
2021年评分最高的推理电影选几个	FilmTele-Play
我需要听一会郝迪主持的都市之声	Radio-Listen
六一儿童节在星期几	Calendar-Query
找到并且播放王茜演的月是故乡明	FilmTele-Play
莫文蔚的歌曲MV帮我搜索一下	Video-Play
点一首邓丽君的月亮代表我的心	Music-Play
放那英的春暖花开	Music-Play
放频率是一零四点四的山东人民广播电台	Radio-Listen
李若彤出演的仙侠剧随即来一部播放一下可以不	FilmTele-Play
给放歌舞升平这个相声来听一下	Audio-Play
你给我播放一下新闻类的990新闻频率呢	Radio-Listen
给我订几张上海到北京的机票	Travel-Query
我想知道去天津的经济舱机票还有吗	Travel-Query
帮我查询明天西安室外温度多少度	Weather-Query
这个月的26号是周几	Calendar-Query
给我调去大林在FM93点7主持的大林评论	Radio-Listen
给我单曲循环贾斯汀比伯的baby	Music-Play
我现在想听一首欢快的日语歌	Music-Play
古天乐主演的香港电影反贪风暴播放一下吧	FilmTele-Play
植树节是星期几	Calendar-Query
问问你知道农历7月7是什么节日	Calendar-Query
冰箱的保鲜模式是否开启	HomeAppliance-Control
大后天开始温度会越来越低不	Weather-Query
我确定我就要打开电脑	HomeAppliance-Control
广播剧破云的预告帮我播放	Audio-Play
我要定一个14号晚上8点跟老公一起吃饭的闹钟。	Alarm-Update
1点25倍速放给我风筝是悬疑片那个	FilmTele-Play
请你帮我查查劳动节是不是5月2日	Calendar-Query
5月21日播放的哥斯拉模式发现C4的这个游戏视频给我打开下吧	Video-Play
帮我定周一晚上十点的闹钟	Alarm-Update
去郑州的走高速怎么走	Travel-Query
把空气净化器打开	HomeAppliance-Control
帮我找一个音乐台CNR音乐之声吧	Radio-Listen
想午睡会儿，帮我把空调切换到睡眠模式吧	HomeAppliance-Control
这里到人民医院的路线是什么	Travel-Query
星期几是情人节	Calendar-Query
上海飞纽约的飞机是今天的吗	Travel-Query
帮我把收音机打开听下广播吧	HomeAppliance-Control
天灸日是农历的哪天	Calendar-Query
可不可以帮我把空调温度调到20度呀	HomeAppliance-Control
等会儿提醒我明天去买蟑螂药	Alarm-Update
薛之谦的歌曲MV帮我搜索一下	Video-Play
准备给孩子做蛋糕，帮我切换到烘焙模式行吗	HomeAppliance-Control
麻烦播放大海航行靠舵手，要合唱的	Music-Play
历史题材，周润发主演的电影孔子	FilmTele-Play
在明天3:30的时候闹铃响起	Alarm-Update
速度点的查查大后天是个什么节假日呢	Calendar-Query
是不是能给我随机来一首凤凰传奇的歌	Music-Play
我想看2020年单依纯在中国好声音唱的寻找失联的爱的视频	Video-Play
怎么坐车到南宁火车站啊	Travel-Query
7月1日去长沙最便宜的汽车票是哪一趟。	Travel-Query
是否能把教育类的广东人民广播电台教育之声播放出来	Radio-Listen
放2019年邓超主持的奔跑吧兄弟	Video-Play
有下午5点一品天下吧找去听	Radio-Listen
可不可以让洗衣机切换到漂洗功能呢	HomeAppliance-Control
能把张东主持的音乐之声给我播放么	Radio-Listen
帮我找到王月的岷江排行榜	Radio-Listen
找一首怀旧歌曲听	Music-Play
找出来鹿晗跳舞的视频	Video-Play
你是不是能给我来一首搞笑的日语歌呢	Music-Play
记得在6月5号喊我和朋友去环球影视城玩	Alarm-Update
请问冬至是几号	Calendar-Query
是不是能给我来一个推理电视剧无证之罪	FilmTele-Play
下月有雪吗	Weather-Query
晚上睡觉记得把电视关了。	HomeAppliance-Control
帮我查询端午节在星期几	Calendar-Query
能不能随机给我点播一个黄龄的歌曲啊	Music-Play
人体传感器打开	HomeAppliance-Control
单曲循环播放李健的抚仙湖。	Music-Play
农历的哪天是蚂拐节	Calendar-Query
能找一个2008年的古装偶像看看不	FilmTele-Play
重庆穿衣指数多少	Weather-Query
能查看一下6月12和7月12都是星期几吗	Calendar-Query
请重复收听频率是一零七点三的市民热线	Radio-Listen
有90年代的经典歌曲来一首吧	Music-Play
90年代之后战争片随机播放一个吧	FilmTele-Play
怎么开车到南安去啊	Travel-Query
林俊杰的修炼爱情很火，现在放一下	Music-Play
请告诉我如何才能步行去海边呢	Travel-Query
我想听一听薛之谦最火的歌曲呢	Music-Play
我需要一个偶像剧去年的看一看	FilmTele-Play
能把空调设为最大空调风速不	HomeAppliance-Control
我想看陈伟霆演古剑奇谭的个人花絮视频	Video-Play
语音报一下礼拜几是9月的13日	Calendar-Query
现在马上给我订五张明天早上杭州飞成都的机票	Travel-Query
放一个周星驰导演的电影的幕后花絮	Video-Play
帮我把电风扇的风速调到二挡	HomeAppliance-Control
查一下怎么去美国加州坐公交还是火车	Travel-Query
播放《潇洒走一回》，叶倩文唱的啊	Music-Play
播放南京地区频率为八九点七的CityFM音乐广播	Radio-Listen
找出拾光里的我们让我回忆一下	FilmTele-Play
帮我放一下律动下午茶	Radio-Listen
找苏州曲艺广播按顺序播放里面的越剧节目	Radio-Listen
小米MIX FOLD的开箱视频找一下	Video-Play
6月13号是农历的哪天	Calendar-Query
客厅的灯太亮了，降低下亮度吧	HomeAppliance-Control
天灸日是什么时候	Calendar-Query
我是真的想要知晓2021年的青年节是不是农历8月12啊	Calendar-Query
请在明天晚上9点提醒我抢鞋	Alarm-Update
给我放才涛的先听为快帮我调下频道找一下	Radio-Listen
两点的时候需要通知我打王者	Alarm-Update
给我讲讲潘多拉这个故事	Audio-Play
立刻给我搜下中国的阴历12月1日是星期几呢	Calendar-Query
播放纪录片舌尖上的中国第三集	Video-Play
把答案告诉我飞往瑞典的航班明天有票不	Travel-Query
放一个麻宁的交通新闻	Radio-Listen
告诉我昨天是几号呀	Calendar-Query
明天晚上8点跟妈妈视频聊天的闹钟帮我开启一下。	Alarm-Update
快点说说星期二是几号呢	Calendar-Query
今天上午一直放刘德华的恭喜发财	Music-Play
现在我想要了解阴历12月11是阳历几号	Calendar-Query
今年的仲夏节是农历的哪天	Calendar-Query
暖风再调低2度热死了	HomeAppliance-Control
秋分具体是哪一天	Calendar-Query
今年的冬至是什么时候	Calendar-Query
我要看1986年的动漫超级肥皂就一集给我循环播放	Video-Play
给我找到FM96点6的中央人民广播电台 	Radio-Listen
能设置未来30天每天提醒我签到的提醒么	Alarm-Update
查询后天哪些地区会刮台风	Weather-Query
找我找一下吴磊演的旋风少女播放一下呢	FilmTele-Play
空气静化器调到自动模式行不行呢	HomeAppliance-Control
教育类的广东人民广播电台教育之声可以播放一下吗	Radio-Listen
把浴霸切换到吹风功能可以不可以	HomeAppliance-Control
我想听FM103.9新闻晚知道	Radio-Listen
内地剧一起同过窗带有人生哲理，让我感受一下吧	FilmTele-Play
给我放一个明道的偶像剧幕后花絮	Video-Play
能营造浪漫氛围的歌曲可以随机播放一首不	Music-Play
麻烦回访一下凌晨四点十分的世界看湖南	TVProgram-Play
回答我去海口的机票还有吗	Travel-Query
那个1:35叫我去上课的提醒帮我删除了吗？	Alarm-Update
请帮我转5月27号凌晨三点的欧冠决赛现场	Video-Play
不用取消10号5点的提醒	Alarm-Update
查一下恒隆广场怎么去	Travel-Query
找一下到万州的路	Travel-Query
1分钟后我要知道的是南昌飞深圳的飞机起飞了吗	Travel-Query
把李易峰版的盗墓笔记调出来看一会儿	FilmTele-Play
查询河南室内外温差	Weather-Query
六点了打开少儿台看棉花糖和云朵妈妈	TVProgram-Play
我要设置一个明天凌晨的闹铃	Alarm-Update
运动时候听的音乐随机播放吧	Music-Play
能不能定一个星期一至星期四早上八点的闹铃	Alarm-Update
昨天陇西刮风了吗	Weather-Query
我有点想听哥哥的歌呢，随机一首就可以	Music-Play
调高南边的空调	HomeAppliance-Control
找一首TFboys的宠爱听一听	Music-Play
播放出山，花粥、王胜男合唱的啊	Music-Play
美国片啊那我要看废柴联盟	FilmTele-Play
我收听的就是FM87.6的文艺广播	Radio-Listen
可以帮我查查飞成田的飞机是今天的吗	Travel-Query
七月石家庄空气质量如何？	Weather-Query
能告诉我明天是端午节吗	Calendar-Query
是不是能随机放一首古典乐啊	Music-Play
我马上就得看赵薇主演的湖南卫视的还珠格格	FilmTele-Play
江南明天有雪吗	Weather-Query
你要在晚上6点的时候提醒我打卡上班	Alarm-Update
播放一个清宫剧孙俪的可以吗	FilmTele-Play
频率是一零七点七的中央电台音乐之声可以收听下给我不	Radio-Listen
打开一下烤箱吧，准备烤鸡翅啦	HomeAppliance-Control
我想查下个月的二号是周几	Calendar-Query
我需要听一个音乐类的湖北人民广播电台交通音乐台可以吗	Radio-Listen
给我看看明天福州穿什么合适	Weather-Query
给我开一下卧室的空调	HomeAppliance-Control
伤感的英文歌曲可以来一首吗	Music-Play
帮我看看哪个节日是农历的九月初九啊	Calendar-Query
能不能请你帮我查农历7月初1是哪天啊	Calendar-Query
我需要你把健身房的空调开到20度	HomeAppliance-Control
2019年1月20日的越南点球大战淘汰约旦给我回访一下吧	Video-Play
5月24日十点多报道地球每年“吃土”5000多吨这个新闻视频再给我放下吧	Video-Play
我想要你给我设置一个闹钟4月22号10点	Alarm-Update
听FM97四川旅游生活广播6点的音乐旅途要经典篇	Radio-Listen
前天天津下雨了，那天的降水量有多少毫米	Weather-Query
查询未来一周宁波会持续降雨吗	Weather-Query
你能播放一下神州之声付明月主持的那个吗	Radio-Listen
我需要一首90年代的舞曲听一会	Music-Play
麻烦播放一首专辑英雄本色里的歌	Music-Play
王者荣耀2021年春季赛季前赛的视频帮我找一下	Video-Play
永康18号到20号没有暴雨吧	Weather-Query
播放河北交通广播快乐晚点名	Radio-Listen
查询查询去往贵阳的高客发车了没	Travel-Query
请给我沈阳近一个月的降水量	Weather-Query
打开日历查看查看6月1日是青年节还是儿童节啊	Calendar-Query
能不能帮我查看下去厦门的高铁	Travel-Query
帮我找的最新上映的喜剧片吧	FilmTele-Play
循环收听陈颖镭的实用技巧	Radio-Listen
听一下中央广播电台的经济之声	Radio-Listen
能不能让冰箱冷藏室温度调到4度呢	HomeAppliance-Control
可否告诉我阳泉开过来的高铁哪天才有	Travel-Query
放余玉婷的思念是一种病来听	Radio-Listen
顺序播放林海的钢琴曲吧	Music-Play
麻烦帮我找下陕西戏曲广播按时间顺序播放里面的花鼓戏节目	Radio-Listen
这电扇风速太大了，快调低点儿	HomeAppliance-Control
我想知道明天的农历是多少啊	Calendar-Query
我现在可以马上播放任素汐的驴得水	FilmTele-Play
福建明天有台风吗	Weather-Query
纪录片电竞进化论帮我查询一下	Video-Play
告诉我明天可以穿什么	Weather-Query
播放七点山西的降雨量	Weather-Query
查一查昆明会不会下暴雨。	Weather-Query
看看明年的元旦是星期几	Calendar-Query
曹盾导演的历史剧来一个吧	FilmTele-Play
我说把我刚刚定的闹铃改成明天凌晨	Alarm-Update
我要去北京警犬基地已偏离路线重新搜索一下	Travel-Query
1月4日沈阳温度降低，那能下雪吗	Weather-Query
帮我设置周一到周五的闹钟，备注起床	Alarm-Update
放韩红2020年巡回演唱会唱歌的视频	Video-Play
重庆明天会刮风吗	Weather-Query
提醒我明天下午的日程，我忘掉了	Alarm-Update
播一下张国荣的一切随风这张专辑	Music-Play
告诉我明天海淀气温度数	Weather-Query
给我看一个关晓彤的二十不惑嗯可以吗	FilmTele-Play
播放郑爽演的青春斗	FilmTele-Play
后天10:30记得叫我别忘带身份证	Alarm-Update
请帮我找到中国戏剧广播里的秦腔节目按节目列表顺序列表播放	Radio-Listen
阿冗的专辑与我无关播放	Music-Play
能否查查飞珠海的飞机起飞了吗	Travel-Query
调到林贺的1039交通服务热线	Radio-Listen
星期五是植树节吗	Calendar-Query
调高空调听到没有	HomeAppliance-Control
盘锦明天最高多少度	Weather-Query
周二晚上八点陪孩子读书的提醒帮我设一下。	Alarm-Update
查一查中国的阴历7月初7是什么节日呢	Calendar-Query
定闹钟需要在下午四点给我爸打电话	Alarm-Update
我要听那英的烟嗓山不转水转	Music-Play
我想你将我明天上午的日程全部删除	Alarm-Update
提醒我今天晚上10点给宝宝换尿不湿	Alarm-Update
查询未来一周鞍山的天气情况	Weather-Query
帮我查一查淄博始发的和谐号是17点的吗	Travel-Query
把空气净化器调成弱风好吗	HomeAppliance-Control
我想看3月22日讲解的黄忠连续带走鲁班亚瑟的游戏视频	Video-Play
请你告诉我几月几号是国庆节呢	Calendar-Query
拔掉饮水机的电源。	HomeAppliance-Control
请循环收听费磊主持的分类讲话电台节目	Radio-Listen
三个小时后，闹钟告诉我去接孩子	Alarm-Update
我想你找一个2020年的新加坡剧播放一下	FilmTele-Play
我需要关了电脑	HomeAppliance-Control
45分钟后不用提醒我检查作业	Alarm-Update
帮我放喜羊羊与灰太狼之运动英雄传7点23的视频回放	TVProgram-Play
是否能够在3点喊我回家吃饭	Alarm-Update
给我看看周末去淄博的靠窗硬座。	Travel-Query
现在去公司怎么走快	Travel-Query
播放阿宝的民歌走西口	Music-Play
让电扇摇头可以不可以嘛	HomeAppliance-Control
珠江的加油站小茉播放了吗帮我看下	TVProgram-Play
你给我播放一首80年代的古典音乐可以吗	Music-Play
这个屋空调的风速调至最强	HomeAppliance-Control
荣耀发财快报5月22日那一期给我再回放下吧	Video-Play
播一下激情的岁月	FilmTele-Play
5分钟后帮我查询中国的阴历2月初8是昨天吗	Calendar-Query
我能随机听一首莫文蔚的歌曲不	Music-Play
我要听教育类的广东人民广播电台教育之声	Radio-Listen
把周一下午五点开例会的事项帮我设定一下。	Alarm-Update
今天太热了，快帮我打开空调并且调到18度	HomeAppliance-Control
去飞天花园怎么开车过去	Travel-Query
想听嘉雯7点半的全新动力	Radio-Listen
查一下周日到韩国的机票	Travel-Query
甘肃空气湿度大吗用不用带加湿器	Weather-Query
放战天狼不是战狼赶紧放战天狼	FilmTele-Play
你能在明天下午4:45的时候提醒我回酒店拿电脑吗	Alarm-Update
跟我说说江西南边的湿度	Weather-Query
一个半小时后帮我关掉热水器	HomeAppliance-Control
大前天是农历多少呀	Calendar-Query
能不能继续收听我上次听的频率一零四点七的我要现在电台	Radio-Listen
6月22号时候星期几	Calendar-Query
帮我放一个泰国的家庭伦理剧吧	FilmTele-Play
找到怀远的最近路线	Travel-Query
我要看一个俄罗斯今年上线的电影	FilmTele-Play
播放一个泰国版的宫	FilmTele-Play
收听频率是一零六点六的济南人民频道	Radio-Listen
我要坐周四的动车去北京	Travel-Query
吴昕参加的乘风破浪的姐姐帮我播放一下	Video-Play
打开一下空气清洁器，空气不好	HomeAppliance-Control
想看拜托了班长的大结局帮我播放一下	FilmTele-Play
我想听电台节目Music40	Radio-Listen
给我调到幺零二点七的丹徒人民广播电台	Radio-Listen
给我搜索一部二战纪录片	Video-Play
有没有赵丽颖唱小幸运的视频	Video-Play
记得帮忙关掉电脑	HomeAppliance-Control
日本动漫咒术回战帮我找一下	Video-Play
收听九筆的爱上男声FM	Radio-Listen
是不是能马上查询一下惠州始发经停的飞机今天有票吗	Travel-Query
我准备一会儿就听中央广播电台的文艺之声	Radio-Listen
明天的闹钟九点吧	Alarm-Update
查查东京飞来的客机是哪天到呢	Travel-Query
放李竹的小苏电台	Radio-Listen
查一下明天华北地区空气质量怎么样	Weather-Query
打开香港最新的紫外线指数报告	Weather-Query
给我播放美国出版的电影黑客帝国。	FilmTele-Play
可以只删除7号晚上的备忘录吗	Alarm-Update
美国好看的动漫精彩解说有么	Video-Play
那个中国电视剧号手就位的花絮播放一下吧	Video-Play
悬疑的电影去年上线的播放一个可以不	FilmTele-Play
播放古琴曲梅花三弄	Music-Play
收听一个频率是一零七点六的广东人民广播电台教育之声	Radio-Listen
明天可以穿短袖了吗	Weather-Query
明天石家庄风大吗	Weather-Query
从中国去米兰的机票是不是很贵？	Travel-Query
今天是农历几日呢	Calendar-Query
2019年陈鸿宇的专辑三旬里的歌曲随机来一个啊	Music-Play
找一下到芜湖的高速路线	Travel-Query
后天广州穿衣指数怎么样	Weather-Query
帮我放频率是八八点九的商业电台第一台	Radio-Listen
查询未来一周郑州天气状况	Weather-Query
今晚想听广西交通广播电台的交通新闻	Radio-Listen
播放埙演奏的走西口	Music-Play
给我收听频率是一零一点七的番愚电台	Radio-Listen
频率是八九点九的都市792收听一下呢	Radio-Listen
绵阳湿度怎么样	Weather-Query
续播一下范冰冰演的那个电视剧	FilmTele-Play
拨到FM93点7铁锟的重点关注	Radio-Listen
设置晚上7点去健身房的闹钟	Alarm-Update
明天长春会下冰雹吗	Weather-Query
我想要知晓2021年的建军节是农历几月几日	Calendar-Query
请看一下星期5是哪天啊	Calendar-Query
九月一号气温多少用穿长袖吗	Weather-Query
我想听90年代的治愈老歌	Music-Play
将9号上午8点还花呗的事宜设置一下。	Alarm-Update
让我知道一下沈阳飞三亚的飞机起飞了吗	Travel-Query
不能查一下榆林开过来的复兴号哪天才有	Travel-Query
5月17日用敌人的抢吃鸡的游戏视频再给我放一遍	Video-Play
周几是圣瓦伦丁节	Calendar-Query
加湿器设置成六十五度就行	HomeAppliance-Control
去上海经济舱还有吗	Travel-Query
我要回家怎么走	Travel-Query
情人节是哪一天	Calendar-Query
我想看18年上线的动作类电影呢	FilmTele-Play
给我播放窥探的第十集可以吗	FilmTele-Play
随便播一个2021年晚上18点更新的动漫	Video-Play
播放李克勤唱的红日	Music-Play
把台灯的亮度调到40%就行	HomeAppliance-Control
赶紧帮我去查查开往延安的磁悬浮列车哪天有呀	Travel-Query
播放一下国创动漫山河剑心	Video-Play
给我一份江西的湿度这几天的情况调查	Weather-Query
立刻播放童安格的《其实你不懂我的心》	Music-Play
请告诉我今年辛亥革命纪念日是星期几？	Calendar-Query
帮我把微波炉切换到解冻模式吧	HomeAppliance-Control
下周四是几月几号	Calendar-Query
地上灰尘有点多，帮我把吸尘器打开吧	HomeAppliance-Control
我要听一下王菲与那英合唱的相约九八	Music-Play
现在汕尾是不是在下雨	Weather-Query
请给我把暖风调低点啦	HomeAppliance-Control
我想听教育类的广东人民广播电台教育之声	Radio-Listen
傣族的泼水节是哪一天呢	Calendar-Query
帮我找一个60年代的恐怖悬疑片	FilmTele-Play
提醒我在20分钟之后揭面膜	Alarm-Update
到安阳的12点的汽车票还有吧	Travel-Query
空调调成最大风速	HomeAppliance-Control
我想听魏晨的花开那年	Music-Play
我需要看一个贺军翔主演的台湾偶像剧呢	FilmTele-Play
查一下下个月去西安的机票	Travel-Query
快点找出来电视剧铠甲勇士第一集的花絮	Video-Play
定一个明天早上9点去公园的闹钟。	Alarm-Update
现在去公司给我开开导航吧	Travel-Query
能不能给我单曲循环一下张学友的吻别呢	Music-Play
大声告诉我青岛到郑州的高铁是几点的呢	Travel-Query
综艺节目脱口秀大会第3季给我找一下	Video-Play
把明天10点的闹钟打开	Alarm-Update
要过什么节日了下周三	Calendar-Query
音乐加点儿糖那个就是FM950听那个	Radio-Listen
请给我播放2016年美国电视剧副总统第五季拍摄花絮	Video-Play
建党节是几月几号	Calendar-Query
秦皇岛现在几度还能下海吗	Weather-Query
关闭洗碗机	HomeAppliance-Control
我想要看张翰和赵丽颖演的杉杉来了	FilmTele-Play
记得提醒我晚上10点喝药	Alarm-Update
FM87点6调到北京人民广播电台文艺台	Radio-Listen
去年元旦是农历的什么时候	Calendar-Query
随机播放2019未LIVE巡回演唱会上海站LIVE专辑内的歌曲呢	Music-Play
定一个周六下午2点放风筝的提醒。	Alarm-Update
播放独孤皇后	FilmTele-Play
记得提醒我下午3点送孩子去补习班	Alarm-Update
沧州雾霾指数增强了吗	Weather-Query
这空调风速调大啊	HomeAppliance-Control
给我放一下经典947	Radio-Listen
再续播三集爱情公寓第三季。	FilmTele-Play
调到尼珍主持的民族之声	Radio-Listen
我想看王者荣耀解说的回放	Video-Play
找几个科比以前的金典篮球比赛视频来看	Video-Play
最近有什么新电影，调到小楚和野营的节目爱电影了解一下	Radio-Listen
播放一个鬼王酒吞童子CG视频	Video-Play
有点热，帮我把风扇风力调大些	HomeAppliance-Control
我们现在想收听安然主持的婚姻保卫战	Radio-Listen
农历的什么时候是复活节	Calendar-Query
风扇定时一小时后关机	HomeAppliance-Control
观看美国电影绿皮书。	FilmTele-Play
我想要设一个明天下午七点的闹钟	Alarm-Update
我需要你收听一个经济类的宜昌经济台呢	Radio-Listen
今晚有阵雨没有	Weather-Query
成都到西宁火车站怎么到	Travel-Query
开启全部灯的夜间模式	HomeAppliance-Control
台湾林心如的电视剧给我播放一个行吗	FilmTele-Play
现在你帮我调到常州交通广播的新闻快点知道	Radio-Listen
请问今天还有21点的汽车票去桃仙机场吗	Travel-Query
几月几号是酥油花灯节	Calendar-Query
影音厅播放唐3	HomeAppliance-Control
时不知归内的歌随机一首给我听听就可以	Music-Play
你能把迪丽热巴主演的三生三世枕上书播放给我看么	FilmTele-Play
快点报一下19点有珠海始发去汕头的汽车不	Travel-Query
收听频率是一零一点八的北京不眠夜	Radio-Listen
下午风大吗能骑电车出门不	Weather-Query
四川山区空气质量怎么样？	Weather-Query
帮忙定一个周日上午8点去加油站加油的闹钟。	Alarm-Update
能来一首21世纪的英语歌曲不	Music-Play
立刻马上查查星期二是几号呢	Calendar-Query
在今天晚上九点提醒我去关电视	Alarm-Update
今天暴雨什么时候下啊	Weather-Query
请在今天下午两点叫我去上课	Alarm-Update
快查下汕头去往广州的大客车发车了没	Travel-Query
查查今天是哪个节假日	Calendar-Query
今天能下雪吗，能堆雪人吗澳门那里	Weather-Query
给我放一下今天有关女排的新闻	Video-Play
莫文蔚的歌是否可以随机播放一个	Music-Play
给我听一个开浩御书房的中国文学史	Radio-Listen
从天津到澳门的飞机需要多久。	Travel-Query
播放一下山河岁月那个记录片	Video-Play
天美暗改司空震这个王者容易得游戏视频是在哪个月播放的	Video-Play
现在让风扇停止摇头好吗	HomeAppliance-Control
找一个音乐电台要正放英语歌儿的那种	Radio-Listen
报一下去西宁的机票还有吗	Travel-Query
把今天下午3点的提醒修改成每隔一小时提醒	Alarm-Update
